{
  "schema_version": 1,
  "id": "example-manual-workshop-2027",
  "revision": 2,
  "origin": "manual",
  "facts": {
    "title": "Example manually added lattice workshop",
    "type": "workshop",
    "start_date": "2027-05-12",
    "end_date": "2027-05-13",
    "start_time": null,
    "end_time": null,
    "timezone": null,
    "location": {
      "venue": null,
      "city": "Example City",
      "country": null
    },
    "attendance": "unknown",
    "official_url": "https://example.org/events/manual-workshop",
    "summary": null,
    "deadlines": [
      {
        "kind": "registration",
        "label": "Registration deadline",
        "date": "2027-04-20",
        "time": null,
        "timezone": null
      }
    ],
    "lifecycle": "scheduled"
  },
  "sources": [
    {
      "id": "example-editor-reference",
      "kind": "editor",
      "url": null,
      "posted_at": null,
      "retrieved_at": null,
      "note": "Synthetic editor input for contract demonstration only."
    },
    {
      "id": "example-announcement",
      "kind": "announcement",
      "url": "https://example.org/announcements/lattice-workshop",
      "posted_at": "2026-10-01T09:00:00Z",
      "retrieved_at": null,
      "note": "Synthetic text: Example lattice workshop, 12–13 May 2027, Example City. Register by 20 April 2027."
    }
  ],
  "evidence": [],
  "related_events": [],
  "identity_aliases": [
    "https://example.org/events/manual-workshop"
  ],
  "warnings": [],
  "editor_overrides": [
    "/facts/title",
    "/facts/location/city"
  ],
  "decision": {
    "status": "approved",
    "reviewed_revision": 2,
    "reason": null,
    "acknowledged_warnings": []
  },
  "history": [
    {
      "action": "approve",
      "actor": "example-editor",
      "at": "2026-10-08T10:00:00Z",
      "revision": 1,
      "note": "Synthetic approval; no real event is being published."
    },
    {
      "action": "edit",
      "actor": "example-editor",
      "at": "2026-10-08T11:00:00Z",
      "revision": 2,
      "note": "Matched synthetic reminder; kept manual title and city, added provenance."
    },
    {
      "action": "approve",
      "actor": "example-editor",
      "at": "2026-10-08T11:00:00Z",
      "revision": 2,
      "note": "Reviewed provenance addition."
    }
  ]
}
